date,title,url,bodyText,keywords,section
2024-05-28T00:51:58Z,Pro-Palestine protesters at ANU move campus camp by 50 metres ahead of noon deadline,https://www.theguardian.com/australia-news/article/2024/may/28/anu-gives-noon-ultimatum-as-pro-palestine-protesters-refuse-to-disband-campus-camp,"Student protesters in Canberra have moved their pro-Palestine encampment to a new location after police demanded they pack up by noon on Tuesday. Protesters at the Australian National University voted on Monday night to relocate their camp 50 metres down the road, saying they had engaged in good faith. But they condemned what they called “reckless and unjustifiable intimidation tactics” from the university. The ANU dramatically escalated its response to the on-campus occupation on Monday, demanding protesters vacate their site at Kambri, in the centre of campus. Police attended campus at the ANU’s request on Monday and warned students that failure to comply with university directions to leave the site by midday on Tuesday “may result in further action by ACT Policing”. An ANU spokesperson said the university had ensured that protests were safe, appropriate and lawful. “ANU has provided options for the protestors to continue their protests in ways that are respectful and safe for the entire university community,” the spokesperson said. “The university will continue to discuss these options with protestors.” ACT police said officers remained in regular contact with ANU security and were monitoring developments with protesters. No arrests had been made in relation to the encampment. ANU initially directed the encampment to move on Monday morning when the director of facilities and services, Jeremy Matthew, said the camp was in a fire evacuation zone, creating an “unacceptable risk” to staff and students. “We’re committed to the safety of this campus,” the encampment spokesperson and ANU student Al, who preferred not to share their surname, said. “We want to engage in good faith, on the fire evacuation or on our demands as a whole.” Sign up for Guardian Australia’s free morning and afternoon email newsletters for your daily news roundup Protesters called on supporters to rally on campus on Tuesday morning in support of the camp and said they planned to continue their campaign. In response, ANU shut down businesses in the Kambri precinct, and blocked off public access to a number of buildings adjacent to the Kambri Lawns, including the Marie Reay teaching centre and Chifley library. The ANU students’ association president, Phoenix O’Neill, told the rally the protest had been “disruptive, but peaceful”. “The encampment has moved but the goal of making the university divest has absolutely not,” they said. Students and a number of staff then marched down University Avenue past their new camp site before arriving at management offices. Earlier on Monday ANU security ordered the remaining students entering their fourth week occupying the site to immediately disband. Students rejected the demands, instead issuing a call-out for supporters and legal observers to reinforce numbers. In a video posted to social media, an organiser said a vote had been taken and the remaining protesters had decided to stay on at the Kambri site. “The police have come and told us that we need to leave but we as a collective have decided we’re going to say,” they said. “We will not be moved, we will be staying in Kambri.” From 8am to 3pm on Monday, police officers joined about two dozen members of campus security as protesters drummed on upturned buckets, chanting: “We are the students. We won’t be silenced. Cut the ties now, now, now, now.” The ANU spokesperson said: “No one has been told not to protest.” The direction follows meetings with a small group of students who were advised to disband or risk breaching the university’s code of conduct. Students refused, vowing they would not move until ANU disclosed and divested its ties to weapons manufacturers. Both the University of Melbourne and Curtin University have agreed, in part, to protesters’ demands while negotiating an end to encampments. Camps at La Trobe and Deakin University have also been disbandedas university managements warn of disciplinary action. On Monday afternoon, student protesters at Adelaide University and RMIT announced they would voluntarily pack up after four weeks, while adding they would continue to fight for the Palestinian cause. Asked whether ANU would change its position, the spokesperson said all university investments were governed by its socially responsible investment policy. “The university thanks our student body for drawing our attention to areas that we may need to now consider in 2024,” they said. “This includes expanding companies for review, along with emerging areas of research including artificial intelligence. “The university has listened to this important feedback from its students and thanks them for it.”",Australian universities; Australia news; Israel-Gaza war; Canberra,Australia news
2023-11-25T10:00:46Z,King’s estate to transfer £100m into ethical funds after bona vacantia revelations,https://www.theguardian.com/uk-news/2023/nov/25/kings-estate-transfer-cash-ethical-funds-bona-vacantia-revelations,"King Charles’s estate has announced it is transferring more than £100m, including funds collected from dead people under the archaic system of bona vacantia, into ethical investment funds after an investigation by the Guardian. The surprise announcement came amid growing pressure on the king over the Duchy of Lancaster’s use of funds collected from people who die in the north-west of England with no will or next of kin. On Thursday, the Guardian revealed some of the funds were secretly being used to renovate properties that are owned by the king and rented out for profit by his estate. The duchy conceded that some bona vacantia revenues are financing the restoration of what it calls “public and historic properties”. However, the king’s estate has also been battling separate questions over its management of another portion of bona vacantia funds that are given to its charities. Two of those charities have used bona vacantia to build major endowment funds worth more than £40m. Their accounts state that there are “no specific constraints on the investment portfolio in terms of ethical, social or environmental (ESG) matters”, although investment managers are advised to take such matters “into consideration”. Contacted by the Guardian this week, the Duchy of Lancaster initially declined to say whether its charities had invested in any oil or gas, tobacco, weapons or mining companies. However late on Friday, a spokesperson for the estate announced a change in policy. “In line with the king’s longstanding support of ethical investing, the Duchy of Lancaster has begun the process of transferring its investment portfolio into ESG funds. This process is expected to be completed by the end of the financial year,” the spokesperson said. There been no suggestion from the king’s estate that it plans to cease collecting bona vacantia or change how it is spent. However, the shift in investment policy will bring the Duchy of Lancaster’s approach into line with that of the Duchy of Cornwall, another royal estate that receives bona vacantia funds, which has an ethical investment policy. The king previously owned and closely managed the Duchy of Cornwall, which raises profits for the heir to the throne. When Charles became king, it was inherited by his son Prince William. At the same time Charles inherited from his mother the Duchy of Lancaster, which exists to raise “private” income for the monarch. Both the duchy itself, and its charities, have investment portfolios. The duchy’s own portfolio, according to its accounts, include equities, bonds and other financial investments worth £74m. That too is now being transferred to ethical funds. The charities the duchy gives bona vacantia revenues to, the Duchy of Lancaster Benevolent Fund and Duchy of Lancaster Jubilee Trust, have also built large endowment funds, worth £18m and £26m respectively. Both charities’ accounts state they aim for an annual return of £500,000 from their investments, and benchmark the success of the bulk of their stock investments against the FTSE All-Share Index, an index that includes companies such as Shell, BP and British American Tobacco. Ben Faulkner, of the ethical investment company EQ Investors, said benchmarking against an index could mean replicating investments in the companies involved: “Using an index as a base for a replication strategy is very common, known widely as index tracking. When doing so you will typically have more invested in the biggest companies within the index you are tracking … Shell is the largest listed company within the FTSE All-Share Index.” In the last five years, the Duchy of Lancaster Benevolent Fund has made nearly £2m in income from its investment portfolio, while the Jubilee Trust has made £2.5m. The Duchy of Cornwall, which collects bona vacantia from Cornish residents, has a clear ethical policy in relation to investments by the Duke of Cornwall Benevolent Fund, which has built a £5m endowment. Its accounts state: “The fund is entirely invested in the Newton SRI Fund for Charities, a global and diversified portfolio of equities and fixed interest securities with particular emphasis on environmental, social and governance considerations, screened against negative socially responsible investment criteria.” The Duchy of Lancaster’s announcement of a similar policy comes amid growing questions for the royal estate which has long claimed that bona vacantia proceeds go to charity after costs are deducted. In a shift in language, it now concedes funds are additionally spent on “restoration and repair” of qualifying buildings on the estate. Leaked documents reveal properties deemed eligible for the funds include a suite of properties rented out to raise profit for the king, including holiday lets, farmhouses, a barn on a shooting range and a petrol station. The duchy collects bona vacantia assets from residents of the ancient county palatinate of Lancashire – a territory that includes Lancashire and parts of Merseyside, Cheshire and Cumbria. Cat Smith, MP for Lancaster and Fleetwood, said: “Like so many other local people I was surprised to learn the anomaly that means those dying without a will or heir in the county palatine see their assets passed to the king rather than the state. It’s an unjust and archaic hangover from the medieval times and I’ll be seeking advice on how to bring my constituents’ rights out of the feudal era.” Her comments come after criticisms from two mayors from the north-west of England. “This appears to be a bizarre remnant of feudal Britain,” said the Greater Manchester mayor, Andy Burnham. “At the very least, people in the north-west are owed transparency and accountability. They should also have a say on how these proceeds are used. I would call on the government and the Duchy of Lancaster to initiate a public consultation on this issue to work towards a set of arrangements that could command greater public consent.” Steve Rotheram, the mayor of the Liverpool city region, also expressed concern. “Worthy causes have been bypassed and instead it appears that funding has been spent renovating royal properties. I hope the situation will be clarified urgently and, if money has been misused, it is put back where it should be: with those charities it was promised to.”",King Charles III; Fossil fuels; Climate crisis; Energy; Environment; Monarchy; UK news; North of England; Lancashire,UK news
2023-05-24T18:03:57Z,US Congress members demand that PayPal end ban on Palestinian business,https://www.theguardian.com/technology/2023/may/24/paypal-palestine-ban-us-congress-,"Eleven members of the US Congress have demanded PayPal end a ban on doing business with Palestinians in the occupied territories while permitting Israeli settlers to use the digital payment platform. The letter, authored by Representative Mark Pocan, says PayPal is discriminating against Palestinians by denying “equal access to the digital economy”. “We have significant concerns that, because PayPal does provide services to Israeli citizens in illegal settlements across the West Bank, but does not provide services to Palestinians living in the West Bank and Gaza, PayPal’s current operating status may be infringing upon the rights of Palestinians,” the letter said. “As one of the world’s most recognized payment platforms, PayPal has a responsibility to ensure its services and operations are provided in a non-discriminatory manner.” The letter was sent to PayPal’s CEO, Dan Schulman, ahead of the company’s annual stockholder meeting on Wednesday. It was also signed by Representatives Earl Blumenauer, Betty McCollum, Rashida Tlaib and Greg Casar, among others. PayPal has not explained publicly why it has singled out residents of the Palestinian territories, only saying it regards the area as “high risk”, when other financial service providers, including Visa, Mastercard and Apple Pay, operate in the West Bank and Gaza without problems. The payment platform operates in other areas of conflict, including Yemen and Somalia. Palestinian business owners have likened the PayPal ban to Israeli checkpoints that control movement, saying it stifles economic development because so many other platforms use the payment service, such as eBay. The socially responsible investment firm Harrington Investments, founded by John Harrington, who was at the forefront of pushing US corporate divestment from apartheid South Africa, has put forward a proposal at PayPal’s shareholder meeting that would see the payment platform’s board “establish a policy that ensures that people in conflict zones, such as in Palestine, do not suffer discriminatory exclusion from the company’s financial services”. The proposal says that if PayPal does not wish to implement the policy then it should “provide an evaluation of the economic impact the policy of exclusion has on the affected populations as well as the company’s finances, operations and reputation”. PayPal has urged shareholders to vote against the proposal. A Palestinian American businessman, Sam Bahour, plans to tell the shareholder meeting that his companies have worked with the US and UK governments and the EU but cannot use PayPal. Bahour, who is a founder of the Palestine Telecommunications Company, noted that firms such as Cisco, HP and Oracle operate in the Palestinian territories. “Likewise, it’s a fact that Palestine has a thriving banking sector and all Palestinian banks have corresponding US banks that make money transfers daily. The US Treasury Department is also active in Palestine and has praised the level of Palestinian banking compliance,” he said, according to a transcript of the planned remarks. In 2021, PayPal partnered with the strongly pro-Israel group the Anti-Defamation League to investigate “hate group funding”. Palestinian groups accuse the Anti-Defamation League of conflating the campaign for Palestinian rights with extremism and antisemitism. When the partnership was announced, the American-Arab Anti-Discrimination Committee asked PayPal: “Will you be going after organizations that fund settler terror against Palestinians?”, a reference to registered charities in the US that send tens of millions of dollars a year that fund settlers who expel Palestinians from their land and other activities widely regarded as war crimes under the Geneva conventions. “Will you block orgs supporting the theft of Palestinian land? … Or are extremists just people your new business partner doesn’t like?” PayPal has been asked for comment.",PayPal; Palestinian territories; Israel; Race; Business; Middle East and north Africa; World news; Technology,Technology
2022-10-23T06:30:29Z,The future offers only variants on austerity? Bunk. There are ways to invest and grow | Will Hutton,https://www.theguardian.com/commentisfree/2022/oct/23/the-future-offers-only-variants-on-austerity-bunk-there-are-ways-to-invest-and-grow,"Common sense now has it that “the markets” are Britain’s new rulers. The chancellor, Jeremy Hunt, is co-governing with them, so the story runs, in contemplating “eye-wateringly” difficult decisions to cut public spending, as would a putative Labour successor, Rachel Reeves. Thus, just as libertarian dreams of stupendous unfunded tax cuts to drive growth are now over, so are social democratic hopes of building a just society. Allegedly, the implosion of Trussonomics has made the lights go out across the political spectrum; the future offers only variants of austerity. I disagree. Britain is not yet an emergent economy. It still has vast resources if it chooses to access them. It possesses a fabric of institutions ranging from the UK Debt Management Office to the Bank of England that, given the right constitutional framework and proper economic and political leadership, are more than capable of being the markets’ master rather than their servant. Economic and political choices remain. Nor are “the markets” hegemonic forces that always and everywhere blindly impose austerity and economic suffering. They are simply our creditors, holding our debt and to whom we have to sell more – therefore, they have to be carefully managed. Liz Truss and Kwasi Kwarteng, their heads full of Brexity libertarian arrogance and delusion, chose to ignore that reality. The lesson is not that there are no choices but austerity – it is that successful economic management requires seeing straight. It is true that some market participants, generally the hyper-short-termist hedge funds and day traders, are fiercely pro-free market, anti-regulation and pro-Brexit. But there are many more market actors who, for example, take green and socially responsible investment seriously, are pro-EU, understand the case for regulation as long as it’s not too onerous and get that governments tax, spend and borrow to achieve varying political ends. They don’t automatically veto a social democratic government any more than they would a libertarian one. They veto a stupid government. If there is any shared ideology, it is that they want the government of the day to accept the rules of engagement with any creditor. Their fiduciary obligation is to conserve the assets for which they are responsible, which affects anyone, for example, with a private or occupational pension. Quite right. They look for credible fiscal plans that will be delivered within a well-understood, predictable and above all solid framework that can’t be overturned by political whim. Yes, the Truss-Kwarteng growth plan was intellectually risible, but what really spooked, and continues to spook, market actors is that the British constitutional and political system could allow such cultish nonsense to get so far. Even now, the constitutional arrangements of this, a G7 country, are so primitive that they allow a group of Tory backbenchers in the 1922 Committee to set the rules for who will become prime minister. Small wonder that, as Boris Johnson’s ghoulish re-emergence as a leadership contender surfaced on Friday afternoon, sterling and bonds weakened. Britain’s uncodified constitution, in which so much depends on unwritten protocols being respected, has always been vulnerable to one political party going rogue, in which case not only the economy but the rule of law and even democracy itself are threatened. The proroguing of parliament in September 2019 at Johnson’s discretion was a forerunner of what has been happening over the past six weeks. The summary sacking of the permanent secretary of the Treasury with zero process and the overruling of the legal requirement to publish independent economic forecasts with the mini-budget came from the same roots. A minister, exercising regal prerogative power, can do whatever he or she damn well pleases. Now the same principle is written into the financial services and markets bill: a minister is to be given the powers to “recall”, rewrite or veto any dimension of financial regulation that may displease him or her with no parliamentary process. It was one of many reasons for the credit rating agency Moody’s citing “unpredictability in policymaking”, lowering the UK’s credit standing on Friday from stable to negative. Any successful social democratic government thus has to do two foundational things. It needs to reform the constitution so that the presumption becomes that significant changes to our institutional arrangements have to be validated by both houses of parliament rather than left to ministerial fiat. Democratically elected governments set out their proposals in their manifesto and legislate for them; they can respond to changing circumstances by proposing reforms and new regulation but ministers should not be able to govern by whim with no recourse to parliament. Happily, Labour is halfway there with Gordon Brown’s constitutional review, proposing replacing the Lords with a newly powerful upper house democratically recruited from the UK’s cities, regions and nations. To his list of proposed reforms, Brown should add ending “Henry VIII” prerogative powers. Second, there must be a recasting of the UK tax system, far too biased to tax income and not capital, property and wealth. For example, Britain’s housing stock is worth more than £8tn. Council tax – in England, extraordinarily, based on 1991 property values – yields £40bn, a derisory 0.5%of the value of the stock, well below what domestic rates proportionally used to yield before their abolition by Margaret Thatcher. Taking action on this, along with revisiting the taxation of the super-rich and their capital, and the government could comfortably raise the £40bn needed to plug the fiscal black hole. Marry that with a commitment within a new constitutional settlement to respect the independence of the Office for Budget Responsibility, the Bank of England, the Financial Conduct Authority and the yet-to-be-established Audit, Reporting and Governance Authority. Also offer a credible medium-term plan for spending, taxing and borrowing – borrowing only for capital and science investment – and the “markets” will happily hold and buy more UK government debt at reasonable or even falling interest rates. On top, it will offer a credible framework for growth driven by public and private investment. Don’t believe the financial Eeyores. The death of Trussonomics is just that. Britain can have high-quality public services and social justice if it chooses. It just has to choose. • Will Hutton is an Observer columnist",Economic policy; Politics; UK news; Moody's; Business; Liz Truss; Kwasi Kwarteng; Jeremy Hunt,Opinion
